{
  "id": "a1b2c3d4e5f6a1b2c3d4e5f6a1b2c3d4e5f6a1b2c3d4e5f6a1b2c3d4e5f6a1b2",
  "type": "candidate",
  "status": "INTEL_READY",
  "title": "OpenAI just dropped GPT-5 — here's what changed",
  "source_url": "https://openai.com/blog/gpt-5-announcement",
  "priority": 0.87,
  "format": "carousel",
  "template_id": "TPL_BRK1",
  "created_at": "2026-02-16T08:00:00Z",
  "updated_at": "2026-02-16T08:00:00Z",
  "error_log": "",
  "assigned_to": "",
  "tags": ["llm", "products"]
}
